{"generatedAt":"2026-02-02T00:00:00.000Z","keys":[{"createdAt":null,"description":null,"keyId":"key_9ed38005b42d9364601ffab3","publicKeyPem":"-----BEGIN PUBLIC KEY-----\nMCowBQYDK2VwAyEAQ70D1FtwopWnvJeFsiKdThSP/9QADgSeaZYKip79KQI=\n-----END PUBLIC KEY-----\n","purpose":"server","revokedAt":null,"rotatedAt":null,"status":null,"tenantId":"tenant_fixture","validFrom":null,"validTo":null}],"order":"keyId_asc","schemaVersion":"PublicKeys.v1","tenantId":"tenant_fixture"}
